Document_ID,Text
191,dvd copy protection strengthened dvds will be harder to copy thanks to new antipiracy measures devised by copy protection firm macrovision the pirated dvd market is enormous because current copy protection was hacked more than five years ago macrovision says its new ripguard technology will thwart most but not all of the current dvd ripping copying programs used to pirate dvds ripguard is designed to reduce dvd ripping and the resulting supply of illegal peer to peer said the firm macrovision said the new technology will work in nearly all current dvd players when applied to the discs but it did not specify how many machines could have a problem with ripguard the new technology will be welcomed by hollywood film studios which are increasingly relying on revenue from dvd sales the film industry has stepped up efforts to fight dvd piracy in the last 12 months taking legal action against websites which offer pirated copies of dvd movies for download ultimately we see ripguard dvd evolving beyond antipiracy and towards enablement of legitimate online transactions interoperability in tomorrows digital home and the upcoming highdefinition formats said steve weinstein executive vice president and general manager of macrovisions entertainment technologies group macrovision said ripguard was designed to plug the digital hole that was created by socalled decss ripper software it circumvents content scrambling system measures placed on dvds and let people make perfect digital copies of copyrighted dvds in minutes those copies could then be burned onto a blank dvd or uploaded for exchange to a peertopeer network macrovision said ripguard would also prevent against rent rip and return where people would rent a dvd copy it and then return the original ripguard is expected to be rolled out on dvds from the middle of 2005 the company said the new system works specifically to block most ripping programs if used those programs will now most likely crash the company said macrovision has said that rip guard can be updated if hackers find a way around the new anticopying measures
192,sony psp tipped as a musthave sonys playstation portable is the top gadget for 2005 according to a roundup of ultimate gizmos compiled by stuff magazine it beats the ipod into second place in the top ten essentials list which predicts what gadgetlovers are likely to covet this year owning all 10 gadgets will set the gadget lover back 7455 that is 1000 cheaper than last years list due to falling manufacturing costs making gadgets more affordable portable gadgets dominate the list including sharps 902 3g mobile phone the pentax optio sv digital camera and samsungs yepp yh999 video jukebox what this years essentials shows is that gadgets are now cheaper sexier and more indispensable than ever weve got to the point where we cant live our lives without certain technology said adam vaughan editor of stuff essentials the proliferation of gadgets in our homes is inexorably altering the role of the high street in our lives thinks mr vaughan take digital cameras who would now pay to develop an entire film of photos or legitimate downloads who would travel miles to a record shop when they could download the song in minutes for 70p he asks next year will see a new set of technologies capturing the imaginations of gadget lovers stuff predicts the xbox 2 highdefinition tv and mp3 mobiles will be among the list of musthaves that will dominate 2006 it says the spring launch of the psp in the uk is eagerly awaited by gaming fans
193,itunes user sues apple over ipod a user of apples itunes music service is suing the firm saying it is unfair he can only use an ipod to play songs he says apple is breaking anticompetition laws in refusing to let other music players work with the site apple which opened its online store in 2003 after launching the ipod in 2001 uses technology to ensure each song bought only plays on the ipod californian thomas slattery filed the suit in the us district court in san jose and is seeking damages apple has turned an open and interactive standard into an artifice that prevents consumers from using the portable hard drive digital music player of their choice the lawsuit states the key to such a lawsuit would be convincing a court that a single brand like itunes is a market in itself separate from the rest of the online music market according to ernest gellhorn an antitrust law professor at george mason university as a practical matter the lower courts have been highly sceptical of such claims prof gellhorn said apple has sold more than six million ipods since the gadget was launched and has an 87 share of the market for portable digital music players market research firm npd group has reported more than 200 million songs have been sold by the itunes music store since it was launched apple has unlawfully bundled tied andor leveraged its monopoly in the market for the sale of legal online digital music recordings to thwart competition in the separate market for portable hard drive digital music players and viceversa the lawsuit said mr slattery called himself an itunes customer who was also forced to purchase an apple ipod if he wanted to take his music with him to listen to a spokesman for apple declined to comment apples online music store uses a different format for songs than napster musicmatch realplayer and others the rivals use the mp3 format or microsofts wma format while apple uses aac which it says helps thwart piracy the wma format also includes socalled digital rights management which is used to block piracy
194,digital guru floats sub100 pc nicholas negroponte chairman and founder of mits media labs says he is developing a laptop pc that will go on sale for less than 100 53 he told the bbc world service programme go digital he hoped it would become an education tool in developing countries he said one laptop per child could be very important to the development of not just that child but now the whole family village and neighbourhood he said the child could use the laptop like a text book he described the device as a stripped down laptop which would run a linuxbased operating system we have to get the display down to below 20 to do this we need to rear project the image rather than using an ordinary flat panel the second trick is to get rid of the fat if you can skinny it down you can gain speed and the ability to use smaller processors and slower memory the device will probably be exported as a kit of parts to be assembled locally to keep costs down mr negroponte said this was a not for profit venture though he recognised that the manufacturers of the components would be making money in 1995 mr negroponte published the bestselling being digital now widely seen as predicting the digital age the concept is based on experiments in the us state of maine where children were given laptop computers to take home and do their work on while the idea was popular amongst the children it initially received some resistance from the teachers and there were problems with laptops getting broken however mr negroponte has adapted the idea to his own work in cambodia where he set up two schools together with his wife and gave the children laptops we put in 25 laptops three years ago only one has been broken the kids cherish these things its also a tv a telephone and a games machine not just a textbook mr negroponte wants the laptops to become more common than mobile phones but conceded this was ambitious nokia make 200 million cell phones a year so for us to claim were going to make 200 million laptops is a big number but were not talking about doing it in three or five years were talking about months he plans to be distributing them by the end of 2006 and is already in discussion with the chinese education ministry who are expected to make a large order in china they spend 17 per child per year on textbooks thats for five or six years so if we can distribute and sell laptops in quantities of one million or more to ministries of education thats cheaper and the marketing overheads go away
195,napster offers rented music to go music downloading for those that have rejected the free peer to peer services can be a costly business the cost of paying even as little as 70p per track can add up particularly for those people who own one of the new generation of players that can store thousands of songs paying per track for music is becoming as outmoded as paying per minute for internet access and alternative monthly or yearly subscription models are springing up as a more convenient and ultimately cheaper way of owning music music fans are moving away from buying the traditional bundled package of a dozen or more songs that we used to call an album to newer ways that fit their lifestyle either single tracks or subscriptions services said paul myers chief executive of wippit a ukbased music download service while itunes is doing good business with its sales of individual tracks to ipod owners others are questioning whether the concept of owning music is even valid in the digital age napster is due to launch a new rental subscription service dubbed napster to go in the uk in the next few months the service can be used on players that support microsoft windows latest digital rights management technology known as janus this includes players made by samsung rio and creative currently on offer in betaversion in the us the service costs 15 per month for unlimited downloads the technology ensures that music downloaded to the player only remains playable while the user subscribes to the service users need to update their license on a monthly basis or the tunes will no longer play this has outraged some digital music lovers especially as napster already offers a cheaper service for downloading music to the pc napster claims the higher price is a result of record labels charging more for the togo service and says it also offers greater value for customers mr myers is not convinced a rental model will work for consumers weve been offering our unlimited music subscription service for more than three years now and our customers know what they want format interoperability excellent value and the reassurance that music purchased from wippit is theirs to keep and enjoy on whatever device they choose he said who wants to download a track that wont play next month if you decide to unsubscribe to the service or change portable player for an ipod or the latest mobile phone wippit offers a download subscription service for 499 per month or 50 per year it has a catalogue of around 60000 songs
196,nuclear body seeks new tech the computer systems used to monitor the worlds nuclear power installations are so outdated that they are hampering the work of inspectors a spokesman for the international atomic energy agency iaea said its current technology could allow key information to be overlooked as it was more than 20 years old such systems are the only method of tracking nuclear material worldwide the agency has appealed for more funds to update its hardware and software a major overhaul of the system is needed to allow inspectors immediate secure online access to information said project manager livio costantini iaea inspectors make around 3000 visits a year to more than 900 nuclear facilities worldwide they are there to verify official reports of activities in the plants to carry out environmental checks and also to look for any signs that nuclear material is being smuggled in or out of the facility the computer system inspectors currently use for comparing data from earlier visits for instance was built in the 1970s and largely paper based an iaea spokesman said this was extremely inefficient and makes searching for anomalies like searching for a needle in a haystack the organisation is aiming to start a system upgrade in november aiming to provide inspectors in the field with secure online access to previous inspection data design blueprints of nuclear facilities even satellite images of the plant where possible it hopes to link the system with national records of the import and export of nuclear materials further analysis of these could help spot potential smuggling activities or illicit technology transfers between countries according to a spokesman computer specialist at the iaea peter smith would like to be able to incorporate state of the art visualisation techniques more familiar to video games players into the inspectors toolkit the commercials you now see have people are moving around in a virtual world he said if we could have that on our laptops we could be walking through the plant seeing on the laptop how the plant should look and if theres a door in the wall that is not on our laptop then we have a problem the iaea estimates the total cost of the fouryear project to upgrade its technology will be 40m so far it has only received 11m from the us and the uk failure to replace the hardware and software and to integrate fully all the information system components will carry large risks said an agency statement
197,us blogger fired by her airline a us airline attendant suspended over inappropriate images on her blog web diary says she has been fired ellen simonetti known as queen of the sky wrote an anonymous semifictional account of her life in the sky she was suspended by delta in september in a statement she said she was initiating legal action against the airline for wrongful termination a delta spokesperson confirmed on wednesday that ms simonetti was no longer an employee delta has repeatedly declined to elaborate on what it calls internal employee matters a spokesperson reiterated this position on wednesday confirming only that ms simonetti was no longer with the company the spokesperson also confirmed that there were very clear rules attached to the unauthorised use of delta branding including uniforms ms simonetti announced on her blog she had been fired on 1 november she said in an official statement as a result of my suspension and subsequent termination without cause by delta airlines i am moving forward with filing a discrimination complaint with the federal government eeoc us equal employment opportunity commission she added she had also hired a texasbased law firm to initiate legal action for wrongful termination defamation of character and lost future wages ms simonetti told the bbc news website she had received no warning or further explanation when she was suspended on 25 september queen of the sky has received a lot of support and advice from the global blogging community since news of her suspension was brought to light on the bbc news website and others her story has highlighted concerns amongst the growing blogging community about conflicts of interest employment law and free speech on personal websites the blog which she started in january as a way of getting over her mothers death contains a mix of fictional and nonfictional accounts queen of the sky developed over the months as a character in her own right according to ms simonetti in the postings she made up fictional names for cities and other companies she mentioned to protect anonymity but some postings contained images of herself in uniform of the 10 or so images only one showed ms simonettis flight wings she removed them as soon as she was informed of her suspension i never meant it as something to harm my company and dont understand how they think it did harm them ms simonetti said a legal expert in the us speculated that delta might be concerned that the fictional content on the blog may be linked back to the airline after the images were posted delta has been hit recently by pressures of rising fuel costs and fierce competition it has said it needs to cut between 6000 and 7000 jobs and reduce costs by 5bn 27bn a year analysts had warned recently that the airline might have to seek chapter 11 bankruptcy prevention last week it struck a 1bn costcutting deal with its pilots which could save it from bankruptcy the deal would see pilots accept a 32 pay cut in return for the right to buy 30 million delta shares unions said and on monday it negotiated a deal to defer about 135m in debt which was due next year until 2007 the airline also said it had agreed the terms of a 600m loan from american express
198,hollywood campaign hits websites movie studio efforts to stop pirated films being shared on peertopeer networks have claimed a highprofile victim the campaign of legal action is thought to be behind the closure of the widely used suprnovaorg website the site was the most popular place for people swapping and sharing links for the bittorrent network a recent study showed that more than half of the peertopeer traffic during june was for the bittorrent system in a message posted on suprnovaorg on sunday the sites controllers said the site was closing down for good in the way that we all know it if the site did return the message said it would not be hosting any more torrent links it continued we are very sorry for this but there was no other way we have tried everything the only parts that would keep going said the operators of the suprnova site were the discussion forums and net chat channels the site is thought to have closed following an announcement by the motion picture association of america that it was launching legal action against those operating bittorrent servers rather than end users because of the way that bittorrent works server sites do not host the actual file being shared instead they host a link that points people to others that have it by targeting servers the mpaa hopes to cripple bittorrents ability to share files in the opening days of the mpaa campaign the organisation filed 100 lawsuits against operators of bittorrent server site the launching of the legal seems to be having an effect phoenix torrents another popular bittorrent site has also decided to shut down and though it gave no reasons for the closure it is thought to be motivated by the threat of legal action last week finnish police raided a bittorrent site based in the country that according to reports let 10000 users shared pirated films software music and games
199,microsoft gets the blogging bug software giant microsoft is taking the plunge into the world of blogging it is launching a test service to allow people to publish blogs or online journals called msn spaces microsoft is trailing behind competitors like google and aol which already offer services which make it easy for people to set up web journals blogs short for web logs have become a popular way for people to talk about their lives and express opinions online msn spaces is free to anyone with a hotmail or msn messenger account people will be able to choose a layout for the page upload images and share photo albums and music playlists the service will be supported by banner ads this is a simple tool for people to express themselves said msns blake irving this is microsofts first foray into blogging which has taken off as a web phenomenon in the past year competitors like google already offer free services through its blogger site while aol provides its members with journals accurate figures for the number of blogs in existence are hard to come by according to blog analysis firm technorati the socalled blogosphere has doubled every five and a half months for the last 18 months it now estimates that the number of blogs in existence has exceeded 48 million although some speculate that less than a quarter are regularly maintained
200,set your television to wow television started off as a magical blurry image then came the sharpness the colour and the widescreen format now the tv set is taking another leap forward into a crystal clear future although those in europe will have to be patient after years of buzz about highdefinition tv hdtv it is finally taking off in a handful of countries around the world mainly the us and japan if you believe the hype then hdtv will so wow you that you will never want to go back to your old telly hdtv is just the latest musthave technology in viewers homes says jo flaherty a senior broadcaster with the cbs network in the us all television images are made up of pixels going across the screen and scan lines going down british tv pictures are made up of 625 lines and about 700 pixels by contrast hdtv offers up to 1080 active lines with each line made up of 1920 pixels the result is a picture which can be up to six times as sharp as standard tv but to get the full impact programmes need to be broadcast in this format and you need a hdtv set to receive them most new computer displays are already capable of handling highresolution pictures viewers in japan the us australia canada and south korea are already embracing the new tv technology with a selection of primetime programmes being broadcast in the new format which includes 51 digital surround sound but tv viewers in europe will have to wait to enjoy the eyeblasting highdefinition images many highend european tv programmes such as the recent athens olympics are already being produced in highdefinition but they still reach your screen in the old 625 lines the prospects for getting sharper images soon do not seem very encouraging according to consultants strategy analytics only 12 of homes in europe will have tvs capable of showing programmes in highdefinition by 2008 but the hdtv hype spilling out of the us and japan has spurred european broadcasters and consumer electronic companies to push for change big sports and entertainment events are set to help trigger the general publics attention the 2006 world cup in germany will be broadcast in highdefinition in the uk satellite broadcaster bskyb is planning hdtv services in 2006 there is already a hdtv service in europe called euro1080 other european broadcasters especially in france and germany also aiming to launch similar services in britain digital satellite and cable are largely seen as the natural home for hdtv at least while a decision is taken regarding terrestrial broadcast options the communications watchdog ofcom could hand over some terrestrial frequencies freed up when the uk switches off its analogue tv signal for now broadcasters like the bbc are working on their own hdtv plans although with no launch date in sight the bbc will start broadcasting in hdtv when the time is right and it would not be just a showcase but a whole set of programming says andy quested from the bbcs highdefinition support group we have made the commitment to produce all our output in highdefinition by 2010 which would put us on the leading edge one of the options under consideration is to offer highdefinition pictures on the web the bbc has already dipped its toe into this including some hdtv content in recent trials of its interactive media player a video player for pcs it is planning to offer special releases of selected flagship programmes online in the near future according to mr quested this could help put europe back into the running in the race to switch to hdtv this is backed by recent research which suggests that the number of europeans with broadband has exploded over the past 12 months with the web eating into tv viewing habits
201,ultra fast wifi nears completion ultra high speed wifi connections moved closer to reality on thursday when intel said it would list standards for the technology later this year intel is developing ultrawideband technology uwb which would allow fast data transfer but with low power needs uwb is tipped to be used for wireless transfer of video in the home or office and for use in wireless usb devices which need low power consumption a rival uwb standard is being developed by motorola and chip firm freescale at the mobile phone conference 3gsm in cannes last month samsung demonstrated a phone using uwb technology from freescale at a press conference on thursday intel announced that two uwb groups wimedia alliance and multiband ofdm alliance had merged to support the technology uwb makes it possible to stream huge amounts of data through the air over short distances one of the more likely uses of uwb is to make it possible to send dvd quality video images wirelessly to tv screens or to let people beam music to media players around their home the technology has the potential to transmit hundreds of megabits of data per second consumer electronics companies want uwb to replace cables and simplify setup jeff ravencraft technology strategist at intel and chairman of the wireless usb promoter group told technology site zdnet thirty percent of consumer electronics returns are because the consumer couldnt set up the equipment the first products using uwb technology from intel are due to hit the market later this year initially they will be products using wireless usb 20 connections uwb could also be used to create socalled personal area networks that let a persons gadgets quickly and easily swap data amongst themselves the technology works over a range up to 10 metres and uses billions of short radio pulses every second to carry data intel says the benefit of uwb is that it does not interfere with other wifi technologies already in use such as wifi wimax and mobile phone networks
