Document_ID,Text
93,chelsea denied by james heroics a brave defensive display led by keeper david james helped manchester city hold the leaders chelsea after a quiet opening james denied damien duff jiri jarosik and mateja kezman while paul bosvelt cleared william gallas header off the line robbie fowler should have scored for the visitors but sent his header wide chelsea had most of the possession in the second half but james kept out frank lampards freekick and superbly tipped the same players volley wide city went into the game with the proud record of being the only domestic team to beat chelsea this season and there was little to alarm them in the first 30 minutes as chelsea deprived of arjen robben and didier drogba through injury struggled to pose much of a threat indeed it was the visitors who looked likelier to enliven a drab opening played at a lethargic pace shaun wrightphillips watched by england boss svengoran eriksson showed his customary trickery to burst into the right of the area and deliver a dangerous ball which was blocked by john terry but chelsea suddenly stepped up a gear and created a flurry of chances first duff got round ben thatcher and blasted in a shot that james parried to kezman who turned the ball wide soon afterwards jarosik found space in the area to powerfully head lampards corner goalwards but james tipped the ball over chelsea were now looking more like premiership leaders and james kept out kezmans fierce drive before bosvelt and james combined to clear gallas header from duffs corner city broke swiftly up the field and the last chance of a frenetic spell should have resulted in fowler celebrating his 150th premiership goal wrightphillips raced down the left and crossed to fowler but citys lone man up front left free by terrys slip contrived to head wide when it seemed a breakthrough was certain the second half started as quietly as the first although james was forced to divert a cross from the lively duff away from eidur gudjohnsens path there was a nasty moment for petr cech looking for a ninth straight clean sheet in the league when a series of ricochets saw fowler chase a loose ball in the area and collide accidently with the czech republic stopper another quiet spell followed which duff interrupted with a surging run that was halted illegally on the edge of the penalty area by bosvelt lampard stepped up to blast a shot through the wall and james somehow blocked it with his legs another timely challenge this time from richard dunne in time added on prevented gudjohnsen from getting in a shot there was still time for james to produce a sensational save to tip lampards volley round the post cech paulo ferreira gallas terry bridge jarosik tiago 56 lampard makelele duff gudjohnsen kezman cole 63 subs not used johnson smertin cudicini makelele gudjohnsen james mills distin dunne thatcher shaun wrightphillips bosvelt barton sibierski mcmanaman 85 musampa fowler subs not used macken weaver onuoha jordan bosvelt 42093 h webb s yorkshire
94,coach ranieri sacked by valencia claudio ranieri has been sacked as valencia coach just eight months after taking charge at the primera liga club for the second time in his career the decision was taken at a board meeting following the sides surprise elimination from the uefa cup we understand and he understands that the results in the last few weeks have not been the most appropriate said club president juan bautista former assistant antonio lopez will take over as the new coach italian ranieri took over the valencia job in june 2004 having been replaced at chelsea by jose mourinho things began well but the spanish champions extended their winless streak to six after losing to racing santander last weekend that defeat was then followed by a uefa cup exit at the hands of steaua bucharest ranieri first took charge of valencia in 1997 guiding them to the kings cup and helping them to qualify for the champions league the 54yearold then moved to atletico madrid in 1999 before joining chelsea the following year
95,clijsters could play aussie open kim clijsters has denied reports that she has pulled out of januarys australian open because of her persistent wrist injury open chief paul mcnamee had said kims wrist obviously isnt going to be rehabilitated but her spokesman insisted she had simply delayed submitting her entry the doctors are assessing her injury on a weekly basis and if there is no risk she could play but if theres the least risk she will stay away despite being absent from the wta entry list for the tournament which begins on 17 january clijsters would be certain to get a wild card if she requested one clijsters is still ranked 22nd in the world despite only playing a handful of matches last season the belgian had an operation on her left wrist early in the season but injured it again on her return to the tour meanwhile jelena dokic who used to compete for australia has opted out of the first grand slam of the season dokic has not played in the australian open since 2001 when she lost in the first round but the 21yearold would have had to rely on a wild card next season because her ranking has tumbled to 127th fourtime champion monica seles who has not played since last years french open is another absentee because of an injured left foot
96,umaga ready for lions all blacks captain tama umaga has warned the british and irish lions will be his most fearsome opponents yet ahead of their summer tour but umaga in england for saturdays irb rugby aid match also backed new zealand to win the threetest series against the lions he told bbc sport its potentially the most fearsome lineup ive ever come up against theyre awesome but id back us all the way to beat them when they come over lions boss sir clive woodward is set to announce his squad for the junejuly tour next month when woodward was appointed last year it was widely believed he would rely heavily on his former england players but umaga said hed be hard pushed to do that now considering the shape of the six nations dont get me wrong england have got a lot of talented guys and im sure there are some of them wholl make the lions test xv but you cant disguise wales and ireland in particular some of the tries theyve scored have been great ill admit itll be fairly awesome lining up against the likes of brian odriscoll umaga will meet odriscoll in saturdays rugby aid match at twickenham with the irish captain leading the northern hemisphere side odriscoll is among a host of players in the northern hemisphere squad coached by woodward that are tipped for lions callups itll be good for us to get an early idea of some of these guys although a lot can change between now and june umaga said the 31yearold admitted interest in the lions tour was immense calling it the biggest thing to hit new zealand since lord of the rings he added as players its enough for us to be driven by the rarity of playing the lions in fact its not just us all blacks its the talk of the country umaga admitted the fear of injury weighed on his mind ahead of saturdays charity game which features a host of big names including george gregan andrew mehrtens and chris latham but he admitted the value of the cause proceeds of the match will go to aiding victims of the tsunami easily won him over the second southern hemisphere coach rod macqueen made the approach i didnt hesitate it was great when new zealand rugby then gave me the all clear thankfully i didnt know anyone that was involved in the tragedy of the tsunami but you couldnt miss all the horrific reports on the news there are so many people that were affected are still affected and will be affected for a long time its just good to know we can do something minor to help out the match will be televised on bbc one at 1400 gmt on saturday
97,cudicini misses carling cup final chelsea goalkeeper carlo cudicini will miss sundays carling cup final after the club dropped their appeal against his red card against newcastle the italian was sent off for bringing down shola ameobi in the final minute of sundays match blues boss jose mourinho had promised to pick cudicini for the final instead of firstchoice keeper petr cech the 31yearold will now serve a onematch suspension commencing with immediate effect cudicini kept a club record 24 clean sheets last season for chelsea but petr cech has established himself as first choice for mourinho since moving to stamford bridge in summer 2004 the 22yearold czech republic international has set a new premiership record of 961 consecutive minutes without conceding a goal a mark which is still running but mourinho has used cudicini regularly in the carling cup and the italian has only let in one goal in his four appearances during chelseas run to the final
98,scots suffer another injury blow scotlands back row crisis has worsened ahead of the rbs six nations with news that scott gray will miss out on the opening matches the borders flanker has a knee injury and joins donnie macfadyen and allister hogg on the sidelines star number eight simon taylor will miss at least the first two games after damaging an ankle during his comeback scott macleod ankle ligaments and jon petrie cartilage are also doubtful for the opener in paris on 5 february gray 26 who won his first cap against australia at murrayfield last year was hurt in club action at the weekend scotland doctor james robson said a scan has shown damage to the medial ligaments of scotts right knee ruling him out of the first part of the championship we will seek further specialist advice in due course to determine just how long scott may be out for another potential option glasgow flanker andrew wilson has been ruled out for a month after damaging ligaments in both knees against northampton recently flanker jason white and prop tom smith have also been suffering from flu and missed this weeks training sessions we have got plenty of good young players coming through and we have got to look at the opportunities it represents for them rather than the negatives williams added williams could now turn to edinburgh pair alasdair strokosch and simon cross leeds tykes flanker jon dunbar also trained with the squad but is still awaiting verification of his eligibility to qualify for scotland
99,dawson wins england squad recall wasps scrumhalf matt dawson has been recalled to englands training squad ahead of the rbs six nations and been reinstated in the elite player squad coach andy robinson dropped dawson for the autumn tests after he missed training to film a question of sport i always said i would consider bringing matt back if i felt he was playing well robinson said he merits his return on current form newcastles 18yearold centre mathew tait is also in the training squad its obviously an honour to be asked to train with england said tait who has burst into contention recently i look forward to going down and doing the sessions but the most important thing at the moment is sundays game against newport so im not looking any further than that robinson has invited 42 players to attend a threeday session in leeds next week in which his squad will train in part with the leeds rhinos rugby league squad with mike tindall ruled out of the opening two matches and will greenwood sidelined for the entire six nations tait is one of six or seven contenders for the two centre berths stuart abbott jamie noon ollie smith olly barkley and henry paul who retains his place despite his early substitution against australia are also in the mix ben cohen could also be considered after switching from the wing for his club northampton recently prop phil vickery and lock simon shaw both return to the squad after missing the autumn tests through injury while wasps wing tom voyce is recalled the group also includes bath flanker andy beattie and leicester hooker george chuter beattie has matured greatly as a player these past two seasons robinson said jonny wilkinson tindall and martin corry have all been included despite their unavailability for the opening two matches against wales and france the revised 56man elite squad includes wasps hooker phil greening who replaces the retired mark regan and sale wing mark cueto cueto was selected for the november internationals despite not being part of the group but scored four tries in three england appearances leicester scrumhalf harry ellis has also been promoted from the senior national academy and will contest the number nine jersey with dawson and gloucesters andy gomarsall the players in robinsons elite squad can only play 32 matches for club and country they can be called up for a total of 16 training days in addition to the recognised international weeks for each of the years leading up to the next world cup balshaw cohen cueto lewsey robinson simpsondaniel voyce abbott noon paul smith tait tindall barkley hodgson king wilkinson dawson ellis gomarsall chuter thompson titterrell rowntree sheridan stevens vickery white borthwick brown l deacon grewcock kay shaw beattie corry forrester hazell jones moody vyvyan j worsley abbott balshaw borthwick a brown chuter cohen corry cueto dawson ellis flatman gomarsall greening greenwood grewcock hazell hill hodgson kay king lewsey moody noon paul robinson rowntree shaw simpsondaniel thompson tindall titterrell vickery vyvyan white wilkinson j worsley m worsley barkley beattie christophers l deacon forrester c jones palmer rees sheridan skinner smith stevens tait voyce dowson haughton monye roques p sanderson
100,young debut cut short by ginepri fifteenyearold donald youngs first appearance in an atp tennis tournament proved brief as the teenager went out in round one of the san jose open young shot to the top of the junior world rankings when he won the boys singles at januarys australian open but the wildcard entry was dispatched by fellow american robby ginepri in straight sets 62 62 in california despite that he was happy with his tour debut it was fun i had my chances but they didnt come through he said young who beat two players ranked in the top 200 when he was just 14 was only 21 down in the first set before losing 10 of the next 13 games and ginepri six years older than the youngest player to ever win a junior slam and top the global standings admitted he was impressed hes very talented said ginepri hes got a long future ahead of him being lefthanded he was very quick around the court his serve is a little deceptive he came into the net and volleyed better than i thought earlier south korean hyungtaik lee defeated american janmichael gambill 63 76 74 american kevin kim defeated jan hernych of the czech republic 75 63 canadian qualifier frank dancevic downed american jeff morrison 46 76 73 60 and denmarks kenneth carlsen beat irakli labadze of the republic of georgia 67 47 62 63 top seed andy roddick launches his defence of the title on wednesday against qualifier paul goldstein second seed andre agassi opens his campaign on tuesday against wildcard bobby reynolds last years us collegiate champion agassi has won the san jose five times but his run of three straight titles ended last year when he fell to mardy fish in the semifinals fish went on to lose to roddick in the final
101,oconnell rejects lions rumours ireland and munster lock paul oconnell has dismissed media reports linking him to the captaincy of the lions tour to new zealand this summer oconnell is rumoured to be among the frontrunners for the job but says he is totally focused on sundays six nations crunch clash with england i honestly dont think about these reports he told bbc sport the lions thing is all speculation and newspaper talk nothing more i just ignore it and get on with my job he added the only thing that annoys me after reading some reports is what the opposition locks think i can just imagine them saying im going to show this guy whats what about second row play thats the one thing that makes me cringe oconnell who made a tryscoring international debut against wales two years ago is enjoying his meteoric rise into rugbys shop window but refuses to be drawn on the lions i have spoken to sir clive woodward a few times but not for very long certainly nothing about summer holidays he joked he also said he remains wary of wounded englands abilities coming into sundays game after two straight defeats dismissing predictions of a certain irish victory its very dangerous to think that this england team has so much experience and skill you do not become a bad team overnight they have two world class gamebreakers in josh lewsey and jason robinson while charlie hodgson is just ready to click into place he insisted ireland will not make the mistake of being overconfident thats not going to happen in our squad no ireland team lining up to play england will ever fall into that trap he said every time we play england we know what a big task it is look at what they did to us two years ago i remember that game all too well and it was not a good feeling i came on as a replacement and we were losing 136 and ended up getting hammered 426 so i know what can happen when england come to dublin they could so easily have been coming to dublin with two wins and staring a grand slam in the face as well
102,jones medals must go if guilty world antidoping agency wada chief dick pound says marion jones should be stripped of all her medals if found guilty of taking banned substances victor conte of balco laboratories claims the american sprinter regularly used drugs to enhance her performance if she is found guilty she should be stripped of all her medals and banned for two years said pound asked if there was a timescale as to what medals could be taken pound said that is not an issue at all however under international olympic committee ioc rules athletes can only be stripped of their medals if caught within three years of the event jones who won five medals at the 2000 olympics denies using drugs and says she will take legal action over contes allegations balco laboratories is the firm at the centre of a widereaching investigation into doping in the us pound continued if she has indeed taken drugs it is going to be a big disappointment for a lot of people
103,williams stays on despite dispute matt williams insists he has no thoughts of quitting as national coach as a result of the power struggle currently gripping scottish rugby the chairman chief executive and three nonexecutive directors all departed in a row over the games future direction but williams said i want to make it clear that im committed totally to scottish rugby ive brought my family here and weve immersed ourselves in scottish life theres no way that im walking away however he attempted to steer clear of taking sides in the dispute id like to stress that the national team is separate to the political situation he said when you come to an undertaking like this and you are trying to make a difference then there are always people who will begrudge you who are jealous and want to try to drag you down when you have that situation you have to have the courage of your convictions to see it through there was some very unhelpful and uninformed comment that the national team had received a massive increase in budget at the expense of other parts of scottish rugby and that is simply not the case like all good coaches you go and ask for an increase but we were told in no uncertain terms that the financial situation did not allow that the idea that we are lighting cigars with 20 notes while the rest of scottish rugby flounders is absolutely untrue we also attracted criticism because of the number of days players spent with the national team but let me give you the truth our irish counterparts whom we have to compete with in a few days time had 70 days together at the summer they are currently in camp now and they will have another 21 days in camp before the six nations that means they will have 91 days away from their club from july until the six nations we on the other hand will have 16 there must be a winwin philosophy and attitude within scottish rugby and that is what we are after both groups winning not competing
104,campbell to extend sprint career darren campbell has set his sights on running quicker than ever after deciding not to retire from sprinting campbell who won olympic 4x100m relay gold had been unsure about his future but he told five lives sportsweek i had to get back into training before i could decide because if i didnt have the same hunger id have to walk away ive started back and im thoroughly enjoying it im looking forward to it ive got to run under 10 seconds for 100m and under 20 seconds for 200m campbell was part of the british quartet who shocked the americans to win relay gold in athens in august the newportbased athlete and teammates jason gardener marlon devonish and mark lewisfrancis were rewarded with mbes in the new year honours list campbells relay triumph made up for his disappointing displays in the individual 100m and 200m events in athens when he failed to reach the finals the 31yearold who won olympic 200m silver in sydney in 2000 said during the games that a hamstring injury had stopped him from running at his best he was criticised at the time by former olympic champion michael johnson who cast doubt on campbells injury claims to go to athens and finally get the gold ive been trying to get for 24 years was a big relief said campbell it was a chance for me to prove that if id been fit i would have been challenging for the individual medals every season i go and challenge for the medals so why would last season have been any different its just unfortunate that i picked up that injury just before the olympics campbell set his 100m personal best of 1004secs when he won the european title in budapest in 1998 and he ran 2013secs in the quarterfinals of the 200m in sydney on the way to olympic silver
105,irish finish with home game republic of ireland manager brian kerr has been granted his wish for a home game as the final world cup qualifier ireland will close their bid to reach the 2006 finals by playing switzerland in dublin on 12 october 2005 the republic met the swiss in their final euro 2004 qualifier losing 20 away and missing out on a place in the finals in portugal the group four fixtures were hammered out at a meeting in dublin on tuesday the irish open their campaign on 4 september at home to cyprus and wrap up the 10match series on 12 october 2005 with the visit of switzerland manager brian kerr and fai officials met representatives from switzerland france cyprus israel and the faroe islands to arrange the fixture schedule kerr had hoped to finish with a clash against france but got the reigning european champions as their penultimate home match on 7 september 2005 the manager got his wish to avoid a repeat of finishing their bid to qualify with too many away matches republic of ireland v cyprus france v israel switzerland v faroe islands switzerland v republic of ireland israel v cyprus faroe islands v france france v republic of ireland israel v switzerland cyprus v faroe islands republic of ireland v faroe islands cyprus v france cyprus v israel france v switzerland israel v republic of ireland switzerland v cyprus israel v france republic of ireland v israel faroe islands v switzerland faroe islands v republic of ireland august 17 faroe islands v cyprus france v faroe islands switzerland v israel republic of ireland v france cyprus v switzerland faroe islands v israel switzerland v france israel v faroe islands cyprus v republic of ireland france v cyprus republic of ireland v switzerland
106,white admits to balco drugs link banned american sprinter kelli white says she knowingly took steroids given to her by bay area lab cooperative balco president victor conte conte faces a federal trial next year on charges of distributing steroids and tax evasion and white said at first he tried to cover up what he was doing hes the one who told me that it wasnt what he said it was white said in the san francisco chronicle but she added it was my decision to go to him not anybody elses white said conte at first told her the substance was flaxseed oil only to change his story later white failed a drugs test after winning the 100m and 200m titles at the 2003 world athletics championships she was subsequently handed a twoyear ban in may this year and has admitted taking the stimulant modafinil at first white claimed she took the drug to combat narcolepsy but she now takes full responsibility for her actions my whole belief about victor is that he was selling a product white said in the la times whether it be a good product or a bad product he was selling a product white was introduced to conte through her coach remy korchemy who is also a defendant in the balco case the 27yearold believes doping is so common in sport she felt compelled to cheat herself if she was to have any chance of winning i have no clue what its going to take to change that said white i would say i made a mistake and i would never ever go back i would never recommend anyone to take that route
