Document_ID,Text
271,wine comedy up for six film gongs sideways a winetasting comedy starring paul giamatti is up for six independent spirit awards the arthouse version of the oscars the awards are held on 26 february the day before the oscars spanish drama maria full of grace about a colombian woman who becomes a drug courier got five nominations controversial biopic kinsey starring liam neeson as sex researcher alfred kinsey was one of four films to get four nominations the awards now in their 20th year honour quirky lowbudget films all of which must have a degree of independent financing sideways is written and directed by alexander payne who directed the 2002 hit about schmidt winning jack nicholson his 12th academy award nomination these awards for better or worse mean everything said sideways producer michael london adding they were a huge first step toward getting recognition from other awards among the other films receiving four nominations apiece were brother to brother a drama about a young gay black man forced to live on the streets robbing peter and primer primer a 7000 3650 tale of discovery won top prize at the sundance film festival earlier this year walter salles critically acclaimed the motorcycle diaries and the forthcoming thriller the woodsman starring kevin bacon received three nominations each also in the running with two nominations are high school comedy napoleon dynamite the door in the floor and garden state written directed and starring scrubs star zach braff alongside natalie portman the awards were announced by actors selma blair and dennis quaid in los angeles on tuesday
272,musicians to tackle us red tape musicians groups are to tackle us visa regulations which are blamed for hindering british acts chances of succeeding across the atlantic a singer hoping to perform in the us can expect to pay 1300 680 simply for obtaining a visa groups including the musicians union are calling for an end to the raw deal faced by british performers us acts are not faced with comparable expense and bureaucracy when visiting the uk for promotional purposes nigel mccune from the musicians union said british musicians are disadvantaged compared to their us counterparts a sponsor has to make a petition on their behalf which is a form amounting to nearly 30 pages while musicians face tougher regulations than athletes and journalists if you make a mistake on your form you risk a fiveyear ban and thus the ability to further your career says mr mccune the us is the worlds biggest music market which means something has to be done about the creaky bureaucracy says mr mccune the current situation is preventing british acts from maintaining momentum and developing in the us he added the musicians union stance is being endorsed by the music managers forum mmf who say british artists face an uphill struggle to succeed in the us thanks to the tough visa requirements which are also seen as impractical the mmfs general secretary james seller said imagine if you were an orchestra from the orkneys every member would have to travel to london to have their visas processed the us market is seen as the holy grail and one of the benchmarks of success and were still going to fight to get in there its still very important but there are other markets like europe india and china added mr seller a department for media culture and sport spokeswoman said were aware that people are experiencing problems and are working with the us embassy and record industry to see what we can do about it a us embassy spokesman said we are aware that entertainers require visas for timespecific visas and are doing everything we can to process those applications speedily we are aware of the importance of cultural exchange and we will do our best to facilitate that he added
273,tautou film tops cesar prize nods french film a very long engagement has received 12 nominations for frances cesar film awards despite a recent ruling it was not french enough the world war i romantic drama starring audrey tautou was recently ruled too american by a paris court as it was partially backed by warner bros but the cesar organisers modified their rules to allow the film to compete the film directed by jeanpierre jeunet received best actress picture and director nominations last november a court judged the film was too american to compete in french film festivals two associations of french producers challenged jeunets right to french government subsidies because warner bros was a backer the ruling meant the movie which was filmed in france and used french actors and technicians was not eligible to compete for french prizes but alain terzian president of cesar organisers the academie des arts et techniques du cinema said the changes in eligibility rules which allow films of french expression were made three months prior to the court decision other films in the best film category include police drama 36 quai des orfevres arnaud desplechins kings and queen abdellatif kechiches lesquive and frances number one film at the 2004 boxoffice the chorus best actors are daniel auteuil for 36 mathieu amalric for kings and queen gerard jugnot for the chorus philippe torreton for lequipier and benoit poelvoorde for podium tautou will compete against maggie cheung emmanuelle devos yolande moreau and karin viard for best actress michael moores fahrenheit 911 the motorcycle diaries lost in translation eternal sunshine of the spotless mind and 21 grams are all vying in the best foreign film prize the awards ceremony will be held on 26 february this year will smith star of i robot independence day and men in black will be given an honorary cesar along with french singeractor jacques dutronc
274,lasting influence of legend charles ray charles who has won a string of posthumous grammy awards belonged to a pioneering generation of artists that had a huge influence on the course of rock and pop music his sound encompassed so many styles blues gospel jazz rock n roll even country and had a real impact on the nascent uk beat and rb scenes compared in stature to elvis presley by some commentators charles songs cast their spell on such 1960s stalwarts as joe cocker steve winwood eric burdon and van morrison his influence has extended to contemporary artists such as norah jones with whom he recently recorded a duet if james brown was the godfather of soul then ray charles was indisputably one of its founding fathers along with sam cooke he was instrumental in bringing together the gospel fervour of the deep south baptist church with the devils music of rb to pave the way for a new generation of soul artists without charles it is hard to imagine the tearstained atlantic rb sound of aretha franklin otis redding or wilson pickett he was also a talented jazz composer arranger and band leader playing at the newport jazz festival and carnegie hall and recording with noted jazz musicians such as milt jackson and david fathead newman unfortunately he also shared another trait common among many jazz artists of the era that of heroin addiction which led to him being arrested in 1965 his string of 1950s atlantic rb successes included songs that would be covered by the firstgeneration rock n roll greats including ive got a woman roy orbison elvis presley and hallelujah i love her so eddie cochran after the exuberance of his 1959 signature song whatd i say charles turned towards a more poporiented style recording hoagy carmichaels sentimental string ballad georgia on my mind and the upbeat hit the road jack he also won acclaim in the country arena with his interpretations of hank williams standards such as your cheating heart and you win again more than 40 years after its release his 1962 abc album modern sounds in country and western music is still regarded as a classic his version of don gibsons i cant stop loving you topped the pop and rb charts in the us in 1972 he made a rare foray into protest songs with his album a message from the people on it he took a stand on poverty and civil rights echoing similar recordings of the era from progeny such as stevie wonder james brown curtis mayfield and marvin gaye more than 20 years later he would embrace contemporary production with his 1993 album my world which featured hiphop beats although charles claimed at the time not to know what hiphop was among the tributes that poured in from all sections of the music world when charles died aged 73 in june 2004 was one from his friend the producer quincy jones who described him as a brother in every sense of the word there will never be another musician who did as much to break down the perceived walls of musical genres as much as ray charles did he said former manfred mann singer paul jones who sang on 1960s hits such as come tomorrow and sha la la said charles was one of his heroes im quite sure my own writing was influenced by him he told bbc news online i would put money on the proposition that ray charles will have an influence on music forever
275,pop band busted to take a break charttopping pop band busted have confirmed that they plan to take a break following rumours that they were on the verge of splitting a statement from the bands record company universal said frontman charlie simpson planned to spend some time working with his other band fightstar however they said that busted would reconvene in due course the band have had eight top three hits including four number ones since they first hit the charts in 2002 their singles include what i go to school for year 3000 crashed the wedding you said no and whos david the band which also includes members matt jay and james bourne made the top ten with their selftitled debut album as well as the followup a present for everyone in 2003 they won best pop act and best breakthrough act at the 2004 brit awards and were nominated for best british group most recently they topped the charts with the theme from the liveaction film version of thunderbirds which was voted record of the year on the itv1 show the band have capitalised on a craze for artists playing catchy pop music with rock overtones the trio are seen as an alternative to more manufactured artists who are not considered credible musicians because they do not write their own songs or play their own instruments however recent rumours have suggested that simpson has been wanting to quit the band to focus on fightstar he now plans to take fightstar on tour
276,mccririck out of big brother show racing pundit john mccririck has become the latest contestant to be evicted from celebrity big brother he was nominated to leave the channel 4 show by fellow housemates alongside happy mondays dancer bez at one time bez was among the most popular contestants but he has since become withdrawn and argumentative mccririck was ordered to leave the house on monday following jackie stallone the actor sylvesters mother who was first to be evicted bez reacted badly to the news that he had been nominated by five of his fellow housemates whilst john received four votes against him sylvester stallones exwife brigitte nielsen nominated both john and bez she said bez is a difficult human being theres something wrong with him even though hes making an effort hes not very happy in here former holby city actor jeremy edwards said he had nominated bez after he became agitated on friday night and talked about escaping over the wall to go clubbing he said bez was being loopy and stressed according to bookmaker ladbrokes john mccririck was 13 favourite to be evicted on monday while bez was at 94 mccririck faced the public vote on friday and received 67 of the vote to keep him in the house whilst jackie stallone was evicted
277,cult band kasabian surge forward indie dance band kasabian built up a cult following throughout 2004 to secure three brit award nominations the fourpiece leicester band blends dark electronics with rock earning kasabian places on the best british group rock act and live act shortlists they have also earned a reputation as outspoken and charismatic in contrast to fellow brit nominees such as keane and snow patrol british music needs a kick up the arse and britain needs a new band to breathe life into the british people again declared kasabians singer tom meighan noones doing it at the minute music feels like its in the afterlife right now we dont want people to give up on it the serpents going to rise from the sea and scare all the pirates away meighan grew up in leicester with kasabian songwriterguitarist sergio pizzorno and bassist chris edwards a trio which began making music from the age of 17 they enlisted guitarist and keyboard player christopher karloff after spotting him in a pub we saw his long sideburns and thought hey he looks the part well ask him said meighan inspired by britpop and a mutual love of hardcore an early 1990s genre that fused house music with hip hop beats and a dark sensibility they added an electronic element to the traditional guitar sound we got a computer and we cut rocknroll up because theres no point in going back to how it was said meighan its all about new ideas and creativity the bands original approach is reflected in its name inspired by linda kasabian the getaway driver of us serial killer charles manson coincidentally it is also the armenian term for butcher kasabian moved into a remote farmhouse in rutland to record their debut album benefiting from its isolation but also managing to sneak in a few parties while they were there signed to the rca record label kasabian tested the water with two singles club foot and lsf which reached numbers 19 and 10 in the uk singles chart respectively they built up their following on the summer festival circuit opening both glastonbury and t in the park and at a series of guerilla gigs at unusual venues including half time orange a pub next to leicester city football clubs headquarters kasabians selftitled album was released last september to widespread critical acclaim its indie dance stance drawing comparisons to the stone roses primal scream and the happy mondays regarding it as both a fiery assertion of rock n roll ethics and proof that a siege mentality is alive and well in the badlands of rutland water the nmes praise was typical of the albums reception as 2004 progressed kasabian would score a further two hits processed beats and cutt off and embark upon a wellreceived uk tour we take our music seriously definitely but we want to have fun with it said pizzorno this is not a job to us added meighan this is the best life we could ever have this is what its all about and without it wed be lost souls but music needs us as well
278,oscar host rock to keep it clean oscar host chris rock said he will steer clear of bad language when he fronts the awards on 27 february the comedian who recently got into trouble for poking fun at the ceremony is renowned for his heavy use of expletives during his standup routine the live ceremony will be broadcast with a transmission delay on us network abc to ensure swear words are removed ive been on tv and been funny not cursing he said during an interview for cbs networks 60 minutes show as far as content is concerned i will talk about the movies im not really worried about it im sure abc might be more worried about it than me he added the 40yearold comedian caused a furore when he said in an interview with us magazine entertainment weekly recently that he hardly ever watched the oscars and labelled awards ceremonies idiotic the shows producers defended rock and confirmed that he would still be presenting the oscar ceremony saying his comments were humorous digs meanwhile the academy has announced that oscarnominated actress natalie portman will present an award at the ceremony portman who has been nominated for a best supporting actress gong for her role in mike nichols closer joins a growing list of stars set to bestow an award at the ceremony including dustin hoffman drew barrymore renee zellweger and britishborn actress kate winslet
279,prince crowned top music earner prince earned more than any other pop star in 2004 beating artists such madonna and elton john in us magazine rolling stones annual list the singer banked 565m 304m from concerts album and publishing sales with his musicology tour and album he kept madonna in second place as she earned 549m 295m while embarking on her global reinvention tour veterans simon and garfunkel were in 10th place their comeback tour helping them earn 249m 134m last year prince returned to centre stage after a decade in the commercial wilderness the magazine reported the singers 2004 tour took 903m 485m in ticket sales and he sold 19 million copies of his latest album musicology although she grossed more than prince last year madonna remained in second place because of the monumental production costs of her tour heavy metal band metallicas madly in anger with the world tour helped push their 2004 earnings up to 431m 231m they were ahead of sir elton john who took fourth place and almost 427m 23m from performances including a debut on the las vegas strip other seasoned performers in the list included rod stewart whose soldout shows and third volume of the great american songbook covers album helped net him 35m 19m the highestranking rap act in the list was 50 cent who at number 19 took 24m 13m to the bank
280,elvis set for chart hattrick the late us legend elvis presley is likely to score his third uk number one single in three weeks on sunday according to early sales figures the king of rock n roll has already had consecutive charttoppers with jailhouse rock and one night a fool such as i the next in a series of 18 reissues is on course to beat the chemical brothers to the top but his next single its now or never will face a challenge from tsunami charity single grief never grows old sir cliff richard russell watson boy george bill wyman and members of the bee gees the beach boys america and the eagles are expected to feature on the charity song bookmakers have offered odds of 101 for all presleys 18 hits to go back to number one a fool such as i would become the 1001st number one single in uk chart history after one night took the 1000th place on sunday the latest release is currently outselling the chemical brothers comeback single galvanize plus other new releases from athlete ciara and feeder presleys 18 original number ones are being reissued as limited release singles with fans eager to buy the set to fill a collectors box that went on sale in the first week record company sony bmg is now manufacturing 5000 more copies of each single than originally planned to meet demand taking the total number of copies of each song on sale to about 28000
281,applegates charity show closes us musical sweet charity has cancelled its run on broadway after poor ticket sales for its early shows star christina applegate had to pull out of prebroadway performances earlier this month with a broken foot producer barry weissler said he was deeply proud of the show but said the decision to close it was painful but fiscally responsible applegate who starred in tv comedy married with children had been hoping to make her broadway debut in the show the 33yearold injured herself while performing in chicago and had been hoping to recover in time for its official new york opening on 21 april she had received mixed reviews for performances in minneapolis and chicago previews of the 75m 4m show were due to begin on 4 april sweet charity tells the story of charity hope valentine a dancer who always falls in love with the wrong man it was first performed on broadway in 1966 with gwen verdon in the title role while shirley maclaine starred in the 1969 film version
282,tv station refuses adoption show a tv station in the us has refused to show a controversial new series where adopted children try and pick their birth father and win a cash prize the wraztv fox affiliate in north carolina was the only one of 182 stations to refuse mondays show whos your daddy promises 100000 52000 to the contestant if she correctly identifies her father it was met with protests by the national council for adoption which said it exploits sensitive emotions it exploits the sensitive emotions of adoption said thomas atwood president of the national council for adoption it trivialises them adoption is a very personal meaningful experience and it should not be commercialised like this on the pretaped programme the contestant is presented with eight men who may or may not be her natural father if she picks the correct man from the lineup the contestant wins the jackpot prize of us100000 52590 however if she picks the wrong man then the impostor takes the money fox producers defended the show saying it was a positive experience they have made six specials though only one episode has so far been broadcast the special was thoroughly vetted by our standards and practices department to ensure that it was appropriate for broadcast said a fox spokesman however any network affiliate that feels the programming may be inappropriate for their individual market has the right to preempt the schedule wraztv instead chose to air an independentlyproduced film i have roots and branches personal reflections on adoption a documentary about families with adopted children we just dont think adoption is a game show said tommy schenck wraztvs general manager though he said his decision had not been influenced by public protests
283,downloads enter us singles chart digital music downloads are being included in the main us singles chart for the first time billboards hot 100 chart now incorporates data from sales of music downloads previously only assigned to a separate download chart green days boulevard of broken dreams is currently number two in billboards pop chart and tops its digital chart download sales are due to be incorporated into the uk singles chart later this year digital sales in the us are already used to compile billboards hot digital sales chart they will now be tallied with sales of physical singles and airplay information to make up its new hot 100 chart its second new chart the pop 100 also combines airplay digital and physical sales but confines its airplay information to us radio stations which play chart music in addition to green day other artists in the current us digital sales top 10 include kelly clarkson the game and the killers sales of legally downloaded songs shot up more than tenfold in 2004 with 200 million track purchased online in the us and europe in 12 months the international federation of the phonographic industry ifpi reported last month in the uk sales of song downloads overtook those for physical singles for the first time at the end of last year the last week of december 2004 saw download sales of 312000 compared with 282000 physical singles according to the british phonographic industry the uks first official music download chart was launched last september compiling the most popular tracks downloaded from legal uk sites including itunes od2 mycokemusiccom and napster westlifes flying without wings a 1999 track reissued for the occasion was the first number one of the uk download chart a spokesman for the british phonographic industry bpi said the first combined uk download and sales chart was due to be compiled within the first half of this year work is going on across the music business right now to make sure the new chart works to plan he said the bpi spokesman described the uk music download chart compiled by the official charts company as having been a great success since its launch it has provided a focus for the industry and has really driven interest in downloads among music fans he said
284,uganda bans vagina monologues ugandas authorities have banned the play the vagina monologues due to open in the capital kampala this weekend the ugandan media council said the performance would not be put on as it promoted and glorified acts such as lesbianism and homosexuality it said the production could go ahead if the organisers expunge all the offending parts but the organisers of the play say it raises awareness of sexual abuse against women the play promotes illegal unnatural sexual acts homosexuality and prostitution it should be and is hereby banned the councils ruling said the show which has been a controversial sellout around the world explores female sexuality and strength through individual women telling their stories through monologues some parliamentarians and church leaders are also siding with the media council ugandas new vision newspaper reports the play is obscene and pornographic although it was under the guise of womens liberation mp kefa ssempgani told parliament but the works author us playwright eve ensler says it is all about womens empowerment there is obviously some fear of the vagina and saying the word vagina ms ensler told the bbc its not a slang word or dirty word its a biological anatomical word she said the play is being produced and performed by ugandan women and it is not being forced on them the four ugandan ngos organising the play intended to raise money to campaign to stop violence against women and to raise funds for the wartorn north of the country im extremely outraged at the hypocrisy the plays organiser in uganda sarah mukasa told the bbcs focus on africa programme im amazed that this country uganda gives the impression that it is progressive and supports womens rights and the notions of free speech yet when women want to share their stories the government uses the apparatus of state to shut us up
